Rillettes de porc|+ Blancs aromatiques et fringants + Rouges souples|+ Jasnières, montlouis-sur-loire, cheverny, côtes-du-marmandais + Malepère, côtes-du-marmandais
Saucisse sèche|Rouges tendres et frais|Beaujolais-villages, côte-roannaise, IGP Pays d'Oc, IGP Ardèche, irancy, bourgogne
Saucisson brioche|+ Blancs vifs et fruités . Rouges gouleyants|+ Mâcon, touraine, anjou + Anjou-gamay, IGP Pays d'Oc (merlot), saint-amour
Saucisson à l’ail|Blancs aromatiques|Côtes-du-rhône, saint-péray, saint-joseph, minervois, vin-de-corse, côtes-de-provence
Saucisson sec|Rouges souples et gouleyants|Vins primeurs, beaujolais, chiroubles, brouilly, côte-roannaise, irancy, languedoc, côtes-du-rhône, côte-roannaise
Terrine de campagne|Rouges fruités et épices|Lirac, languedoc, marcillac, fronton, bordeaux supérieur, côtes-de-provence
Terrine de gibier|Rouges fruités et corpulents|Fitou, montravel, madiran, vacqueyras, terrasses-du-larzac (languedoc), moulin-à-vent
